{
  "case_id": "case_119",
  "expected_decision": "investigate",
  "primary_effect_relative": 0.0414,
  "is_stat_sig": true,
  "guardrails_ok": true,
  "key_reasons": [
    "srm"
  ],
  "human_rationale": "Split declared 50/50 but observed 50.6%/49.4% differs significantly (SRM p=5.98e-12). Comparison invalid until cause found — investigate the randomization before any ship/no-ship decision. The feature itself is not judged here; the measurement is broken."
}
