{
  "case_id": "case_095",
  "expected_decision": "investigate",
  "primary_effect_relative": 0.0233,
  "is_stat_sig": true,
  "guardrails_ok": true,
  "key_reasons": [
    "unit_randomization"
  ],
  "human_rationale": "Randomized by user but tested at event level — pseudoreplication understates variance, significance unreliable. Re-test at randomization unit or use cluster-robust SE. Investigate."
}
