{
  "case_id": "case_445",
  "expected_decision": "do_not_ship",
  "primary_effect_relative": -0.0,
  "is_stat_sig": false,
  "guardrails_ok": true,
  "key_reasons": [
    "long_term_reversal",
    "not_significant"
  ],
  "human_rationale": "Aggregated -0.00% not sig. Weekly trend shows early gain then reversal."
}
