{
  "case_id": "case_218",
  "expected_decision": "investigate",
  "primary_effect_relative": 0.0101,
  "is_stat_sig": false,
  "guardrails_ok": true,
  "key_reasons": [
    "dilution"
  ],
  "human_rationale": "Feature triggers for ~7% of users but measured over all — effect diluted to non-significance (ITT +1.0%, p=0.2574). Absence of significance here is not absence of effect. Re-analyze on triggered population. Investigate."
}
