{
  "case_id": "case_642",
  "expected_decision": "investigate",
  "primary_effect_relative": 0.0291,
  "is_stat_sig": true,
  "guardrails_ok": true,
  "key_reasons": [
    "missing_data"
  ],
  "human_rationale": "~17% of test events missing and dropped — if missingness correlates with treatment, the surviving sample is biased. Check missingness mechanism before trusting the effect. Investigate."
}
