{
  "case_id": "case_192",
  "expected_decision": "do_not_ship",
  "primary_effect_relative": 0.0159,
  "is_stat_sig": true,
  "guardrails_ok": false,
  "key_reasons": [
    "primary_uplift",
    "guardrail_violation"
  ],
  "human_rationale": "Revenue +1.6% but CTR dropped -4.5%, breaching 3% guardrail."
}
