{
  "case_id": "case_440",
  "expected_decision": "investigate",
  "primary_effect_relative": 0.0079,
  "is_stat_sig": false,
  "guardrails_ok": true,
  "key_reasons": [
    "harking"
  ],
  "human_rationale": "Hypothesis formed after seeing the data (HARKing) and presented as a priori. The premium segment was chosen post-hoc — significance not valid without correction/replication. Confirm on fresh data. Investigate."
}
