{
  "case_id": "case_559",
  "expected_decision": "investigate",
  "primary_effect_relative": 0.0381,
  "is_stat_sig": true,
  "guardrails_ok": true,
  "key_reasons": [
    "seasonality"
  ],
  "human_rationale": "Effect +3.8% measured during major promo week (Black Friday / Cyber Monday) — may not generalize to normal periods. Flag and replicate off-peak. Investigate."
}
