{
  "case_id": "case_220",
  "expected_decision": "do_not_ship",
  "primary_effect_relative": 0.0289,
  "is_stat_sig": true,
  "guardrails_ok": true,
  "key_reasons": [
    "simpson_paradox"
  ],
  "human_rationale": "Aggregate +2.9% sig, but both segments negative (-3.4%, -3.7%) — Simpson's paradox from mix shift."
}
