{
  "case_id": "case_215",
  "expected_decision": "do_not_ship",
  "primary_effect_relative": 0.0024,
  "is_stat_sig": false,
  "guardrails_ok": true,
  "key_reasons": [
    "multiple_comparisons",
    "not_significant"
  ],
  "human_rationale": "Primary not sig. One of 8 secondary metrics sig at p=0.048 — expected false positive under multiple comparisons."
}
